ticker,company_name,market_cap,net_debt,ev,ltm_revenue,ltm_ebitda,ltm_ebitda_adj,ltm_net_income,ev_ebitda,ev_ebitda_adj,p_e,ev_sales,ltm_price,ltm_eps,data_date,notes
NVDA,NVIDIA,,-32.94,4406.05,165.22,98.28,98.28,86.6,44.83,44.83,52.2,26.67,183.22,3.51,2025-10-17,Subject company. Fabless GPU/AI accelerator leader.
AMD,AMD,378.25,,376.27,29.6,5.51,5.51,2.83,68.29,68.29,134.73,12.71,233.08,1.73,2025-10-17,Peer: CPU+GPU overlap; high growth; comparable AI/data center exposure.
INTC,Intel,176.06,,205.15,53.07,9.2,9.2,-20.5,22.3,22.3,,3.87,37.01,-4.73,2025-10-17,Peer: CPU/semiconductor; mature; P/E excluded (net loss FY2024). Impairment charges in EBITDA.
QCOM,Qualcomm (QCOM),175.44,,180.22,43.26,13.87,13.87,11.58,12.99,12.99,15.78,4.17,163.45,10.36,2025-10-17,Peer: fabless semiconductor; mobile/automotive/IoT; lower AI exposure than NVDA.
AVGO,Broadcom (AVGO),1649.66,,1703.17,59.93,32.75,32.75,18.93,52.01,52.01,89.11,28.42,349.33,3.92,2025-10-17,Peer: ASIC/networking chips; data center overlap; high EBITDA margin.
TSM,TSMC,1225.79,,1168.51,119.13,81.75,81.75,51.57,14.29,14.29,29.69,9.81,295.08,9.94,2025-10-17,Peer: foundry (not fabless); included for semiconductor scale comparison. Business model differs.
